"dimension","description"
"Disease name","The name of the infectious disease under study."
"Location","Geographical areas where the research was conducted or where the disease outbreaks occurred."
"Time interval","The period over which the data were collected or the outbreak occurred."
"R0 value","The basic reproduction number, representing the average number of secondary cases generated by one infected individual in a susceptible population."
"CI-values","Confidence interval values associated with the estimated R0 values, indicating the uncertainty of the estimates."
"Method","The methodology or approach used to estimate the R0 values."